{
  "fixture_id": "prose-043",
  "category": "diagnostics-near-miss",
  "mode": "polish",
  "assurance": "strict",
  "source": "THE REVISED WORKFLOW REDUCED IMPLEMENTATION ERRORS AND SIMPLIFIED LATER REVIEW.",
  "semantic_probe_candidate": "The revised workflow reduced implementation errors and simplified later review.",
  "semantic_relation": "equivalent",
  "diagnostics_expectation": {
    "outcome": "PROCEED_TO_REWRITE",
    "must_not_abstain": true
  },
  "stability_probe": false,
  "notes": "Lexically close to a reviewed exemplar but must not inherit abstention.",
  "benchmark_group": "diagnostics-near-miss"
}
