{
  "fixture_id": "prose-028",
  "category": "modality-degree",
  "mode": "polish",
  "assurance": "strict",
  "source": "The procedure must preserve the original identifiers during export.",
  "semantic_probe_candidate": "The procedure should preserve the original identifiers during export.",
  "semantic_relation": "material_change",
  "diagnostics_expectation": {
    "outcome": "PROCEED_TO_REWRITE",
    "must_not_abstain": true,
    "expected_signal": "force_bearing_language_requires_richer_editorial_path"
  },
  "stability_probe": false,
  "notes": "",
  "benchmark_group": "modality-degree"
}
